{
  "stateVersion": "atg.nonce-state.local.v1",
  "nonce": "nonce_exact_action_001",
  "gatePassId": "gatepass_exact_4d2c7b9c4d6fc1800dbfbca6",
  "actionDigest": "sha256:748178af74c0f9eeeb8865a9d8cc1afc34ff64479b75285f11fddd3004415de1",
  "expiresAt": "2026-07-20T09:10:00.000Z",
  "status": "consumed",
  "updatedAt": "2026-07-20T09:05:00.000Z",
  "transitions": [
    {
      "from": null,
      "to": "unused",
      "at": "2026-07-20T09:00:00.000Z",
      "reasonCode": "NONCE_REGISTERED"
    },
    {
      "from": "unused",
      "to": "consumed",
      "at": "2026-07-20T09:05:00.000Z",
      "reasonCode": "NONCE_CONSUMED"
    }
  ],
  "localProcessOnly": true,
  "crossProcessAtomicity": false
}
